{
  "contract_name": "Fill",
  "contract_version": "1.0.0",
  "object_id": "synthetic-Fill",
  "object_version": 1,
  "trace_id": "synthetic-trace",
  "content_hash": "sha256:9982e71f5f3b7e4fc7f8156af38f83d56bb29b7c83334d04cb332567adda52ac",
  "recorded_at": "2026-10-05T02:00:00Z",
  "business_timezone": "Asia/Shanghai",
  "provenance": {
    "event_time": "2026-10-05T02:00:00Z",
    "published_at": null,
    "available_at": "2026-10-05T02:00:00Z",
    "retrieved_at": "2026-10-05T02:00:00Z",
    "publication_precision": "NOT_APPLICABLE",
    "source_id": "synthetic",
    "source_version": "fixture-v1",
    "source_hash": "sha256:84ad53f246eb870dba610ababc5deab5819f4c2a32f25b3c6bccbb711852fa5a",
    "visibility_basis": "SYNTHETIC"
  },
  "reason_codes": [
    "SYNTHETIC_FIXTURE_ONLY"
  ],
  "invalidation": {
    "status": "ACTIVE",
    "valid_until": "2026-10-05T03:00:00Z",
    "invalidated_at": null,
    "conditions": [
      "upstream version/hash changes invalidate"
    ],
    "reason_code": null
  },
  "mode": "DEV",
  "account_id": "synthetic-account",
  "strategy_id": "CORE_40",
  "symbol": "SSE:600000",
  "side": "BUY",
  "quantity": 100,
  "price": "10",
  "notional_cents": "100000",
  "fees": {
    "commission_cents": "123",
    "exchange_cents": "0",
    "other_cents": "0",
    "stamp_cents": "0",
    "slippage_cents": "0"
  },
  "order_ref": {
    "object_id": "synthetic-OrderIntent",
    "object_version": 1,
    "content_hash": "sha256:e303085b60c7db9fff4d5ee724af77de51e6819af9fb472d2335406b27c0f687"
  },
  "approval_ref": {
    "object_id": "synthetic-final-confirmation",
    "object_version": 1,
    "content_hash": "sha256:4f4802e180847c724b0d2f679c7514bce7df1badbb472bc9fe6e91074332cf65"
  },
  "cost_model_version": "synthetic-only",
  "broker_fill_id": "synthetic-fill",
  "executed_at": "2026-10-05T02:00:00Z",
  "execution_source": "SYNTHETIC",
  "slippage_treatment": "INCLUDED_IN_EXECUTION_PRICE"
}
